Topic,Keywords,TargetAudience,Status,Priority
Як автоматизувати бізнес у 2026 році,"n8n, ai, automation",власники бізнесу,published,1

"Розбудова штучного інтелекту в Україні: можливості та перспективи",Штучний інтелект,Інформаційні технології,Бізнесмени,Розбудова штучного інтелекту в Україні: можливості та перспективи
"Автоматизація бізнес-процесів за допомогою AI: переваги та підходи",Бізнес-автоматизація,AI,Підприємці,Автоматизація бізнес-процесів за допомогою AI: переваги та підходи
"Застосування машинного навчання в маркетингових кампаніях",Машинне навчання,Маркетинг,AI,Застосування машинного навчання в маркетингових кампаніях
"Безпека даних в умовах автоматизації бізнесу з використанням AI",Безпека даних,AI,Автоматизація,Безпека даних в умовах автоматизації бізнесу з використанням AI
"Етичні аспекти використання штучного інтелекту в бізнесі: відповідальність та регулювання",Етика штучного інтелекту,Бізнес,Штучний інтелект,Етичні аспекти використання штучного інтелекту в бізнесі: відповідальність та регулювання
"Огляд останніх інновцій у сфері AI-автоматизації бізнесу",Інновації AI,бізнес-лідери та підприємці,"Розглянути останні досягнення у сфері AI та їхнє впливи на бізнес-автоматизацію",1
"Впровадження聊ботів у клієнтську підтримку: переваги та виклики",чатботи,клієнтська підтримка,менеджери зі зв'язків з клієнтами,"Обговорити переваги та потенційні перешкоди впровадження聊ботів у клієнтську підтримку",2
"Автоматизація процесів шляхом використанням RPA та AI",RPA,AI,бізнес-аналітики,"Розглянути можливості автоматизації бізнес-процесів шляхом комбінування RPA та AI-технологій",3
"Безпека даних у епоху AI-автоматизації:最佳 практики",Безпека даних,AI,бізнес-безпека,"Обговорити найбільш ефективні підходи до захисту даних у умовах зростаючої залежності від AI-автоматизації",4
"Як використовувати аналіз даних та AI для підвищення ефективності бізнесу",Аналіз даних,AI,бізнес-стратеги,"Розглянути, як підприємствам можуть скористатися аналізом даних та AI, щоб підвищити ефективність та конкурентоспроможність",5