Topic,Keywords,TargetAudience,Status,Priority

Бізнес-автоматизація,AI-технології,підприємці,Створення автоматизованої системи для керування бізнес-процесами
Інноваційні технології,Штучний інтелект,Цифрові трансформації,Впровадження AI у бізнес для підвищення ефективності
Автоматизація маркетингу,Цифровий маркетинг,Менеджери з маркетингу,Розробка стратегії автоматизації маркетингових процесів за допомогою AI
Цифрові трансформації,Дigitalizace,Керівництво компаній,Планування та впровадження цифрових трансформацій у компанії за допомогою AI
Ефективний менеджмент,Управління бізнесом,Менеджери середньої ланки,Використання AI інструментів для оптимізації бізнес-процесів та підвищення ефективності
Тема 1,AI-автоматизація,бізнесмени,Сuais AI можливо застосувати в автоматизації бізнес-процесів у 2026 році
Тема 2,Машинне навчання,Стартапи,Як використовувати машинне навчання для підвищення ефективності бізнесу
Тема 3,Автоматизація робочих процесів,Керівники компаній,Спосіб автоматизації повторюваних завдань для збільшення продуктивності
Тема 4,Розумні системи,Фахівці з IT,Розробка та впровадження розумних систем для оптимізації бізнесу
Тема 5,Бізнес-аналітика,Аналітики даних,Як використовувати дані та бізнес-аналітику для ухвалення стратегічних рішень в умовах AI-автоматизації
Інтелектуальний аналіз даних,аналіз даних,Інтелектуальний бізнес,aai і бізнес-аналітика 
Автоматизація виробництва,промислова автоматизація,виробники,автоматизація для підвищення ефективності виробництва 
Моделі штучного інтелекту,машинне навчання,стартапи,розробка нових моделей аі 
Ефект від штучного інтелекту,іноземний досвід,директори компаній,впровадження аі у великі компанії 
Практичні застосування аі,робототехніка,студенти-технولوجи,приклади успішного застосування аі у сфері робототехніки